{
  "evidence_items": [
    {
      "content_hash": "sha256:c5a648b19b203843086427ec76fe998fda2f4a75655c9570d4b53856f37224de",
      "evidence_id": "ev_0ebccb64e9c96bd7",
      "excerpt": "Thanks for your information. I have not started the work yet. If @vfdev-5 is already working on this, he could continue. Otherwise, I could take the task.",
      "locator": {
        "locator_type": "json_pointer",
        "value": "/6/body"
      },
      "source_artifact_ref": "src_e3e5bb632a9008fc"
    },
    {
      "content_hash": "sha256:93f7ee968ef0f6e92f779ce410aa3e02a83df2276e9ef3f6ccc52487b4dce8e2",
      "evidence_id": "ev_1d738ccc89b220f0",
      "excerpt": "> The issue is about accessing illegal memory when doing indexing `x[idx]` with invalid indices `idx`. As the real value of `idx` is unknown until running cpp output code, the validation checking need to be done in cpp code. For triton, it adopts `device_asserts` (#98590). For cpp, I suppose maybe to generate a specific kernel for such checking, but I am not clear about the details now. Do you have any idea about the solution? cc @jgong5 @EikanWang\n\nThe places to add assertion would be similar to #98590 (in `ops.load` and `ops.store` functions) while you may consider to refactor the code a bit to reuse the logic in `gen_assert_indirect_indexing` which currently contains two parts: 1) retrieve the size of the indirect indexing which is common for both cpp and triton and can be moved to `common.py`; 2) generate assertion line for triton, which can be left in `triton.py` while for cpp, we add something in parallel in `cpp.py` which generates assertion in c++, e.g., invoking `TORCH_CHECK`.",
      "locator": {
        "locator_type": "json_pointer",
        "value": "/3/body"
      },
      "source_artifact_ref": "src_e3e5bb632a9008fc"
    },
    {
      "content_hash": "sha256:1fd4e91a02a3e2e7415aecae4f6f67cd108927aeaa19b4f11bb6cd7bbb3fca2a",
      "evidence_id": "ev_3ce523f4035fec0c",
      "excerpt": null,
      "locator": {
        "locator_type": "json_pointer",
        "value": "/body"
      },
      "source_artifact_ref": "src_eac3cadd6ecabdbe"
    },
    {
      "content_hash": "sha256:fd351ce96d9a9ab53c46c601f3f7172d6326d0e826b8f3fc8ce385a49642114c",
      "evidence_id": "ev_4bd74b2f6a4b073b",
      "excerpt": "[torch.compile] `sum` out-of-bound read",
      "locator": {
        "locator_type": "json_pointer",
        "value": "/title"
      },
      "source_artifact_ref": "src_eac3cadd6ecabdbe"
    },
    {
      "content_hash": "sha256:d5fdeaa7d7c071578cfd865ba9ba6bd1ee9cf0e8b5eddefb9d04742ddc228110",
      "evidence_id": "ev_53fc887ffb263abb",
      "excerpt": "# success, out-of-bound read\n    # tensor([[ 6.1276e-01, -9.3005e-01,  1.3646e+00, -7.3723e-01, -7.0839e-01,\n    #     -2.8423e-01, -1.4816e+00,  3.2976e-01,  4.8557e-01,  4.1309e-01],\n    #    [ 6.1276e-01, -9.3005e-01,  1.3646e+00,         nan, -7.0839e-01,\n    #     -1.7412e+38, -1.4816e+00,         nan,  4.8557e-01,  4.1309e-01]])",
      "locator": {
        "end_line": 36,
        "locator_type": "json_string_line_range",
        "start_line": 32,
        "value": "/body"
      },
      "source_artifact_ref": "src_eac3cadd6ecabdbe"
    },
    {
      "content_hash": "sha256:d0ee65d922e7abb72b442cd87626e2ed75702819912132203d085a43694c6e8d",
      "evidence_id": "ev_68d50daf8aef43a5",
      "excerpt": "oh, I see this is already assigned to @Valentine233. I wonder what's the state of @vfdev-5's work on this... Sorry for the mess.",
      "locator": {
        "locator_type": "json_pointer",
        "value": "/5/body"
      },
      "source_artifact_ref": "src_e3e5bb632a9008fc"
    },
    {
      "content_hash": "sha256:9b161d7544c83b79c52b63d43a07ffac5cd66264e68512cb6885ef6e0b1f0d08",
      "evidence_id": "ev_7b019d8fbc116df1",
      "excerpt": "Thanks for pinging, yes, I've started working on this issue. @Valentine233, I'll ping on the PR as a reviewer",
      "locator": {
        "locator_type": "json_pointer",
        "value": "/7/body"
      },
      "source_artifact_ref": "src_e3e5bb632a9008fc"
    },
    {
      "content_hash": "sha256:8d94c4b5d37a523ba19e92d88ddc2124b7de8274f28a45cf4ac0d50e4b7c197a",
      "evidence_id": "ev_80fef2c21f3db631",
      "excerpt": "`torch.compile` makes `sum` out-of-bound read",
      "locator": {
        "end_line": 3,
        "locator_type": "json_string_line_range",
        "start_line": 3,
        "value": "/body"
      },
      "source_artifact_ref": "src_eac3cadd6ecabdbe"
    },
    {
      "content_hash": "sha256:d45ffe4b496f3f6bb1601160a45b656af8e3c38a5e0663cb3f85e38adfdb38d7",
      "evidence_id": "ev_9acc867361ca61bc",
      "excerpt": "Ooops, no it's not. It's fixed just for CUDA for now.",
      "locator": {
        "locator_type": "json_pointer",
        "value": "/1/body"
      },
      "source_artifact_ref": "src_e3e5bb632a9008fc"
    },
    {
      "content_hash": "sha256:07479ca57e5250778541441828a56c7a1bb8329fe2d9bbdb24c00ad8b3997ca3",
      "evidence_id": "ev_9fb55aa4e1d4b399",
      "excerpt": "@vfdev-5 is working on this one.",
      "locator": {
        "locator_type": "json_pointer",
        "value": "/4/body"
      },
      "source_artifact_ref": "src_e3e5bb632a9008fc"
    },
    {
      "content_hash": "sha256:527f8b8f4310ceca2827b40b91b84ace70c1c2808b01b65b05446d126d872336",
      "evidence_id": "ev_eebcf6c643f25143",
      "excerpt": "Close since PR merged.",
      "locator": {
        "locator_type": "json_pointer",
        "value": "/8/body"
      },
      "source_artifact_ref": "src_e3e5bb632a9008fc"
    },
    {
      "content_hash": "sha256:775e2e1e8cffdae81b551c672e71ac01cad7b592186a96b8afb5ad6f53b70762",
      "evidence_id": "ev_f7ea9c3c446d285f",
      "excerpt": null,
      "locator": {
        "end_line": 118,
        "locator_type": "json_string_line_range",
        "start_line": 44,
        "value": "/body"
      },
      "source_artifact_ref": "src_eac3cadd6ecabdbe"
    },
    {
      "content_hash": "sha256:811819df2f10b240e43a72e6515dc8b0b595376fe63394f40a78e720c4b05c21",
      "evidence_id": "ev_fbd1ec39099a263a",
      "excerpt": "This is fixed in master. see https://github.com/pytorch/pytorch/pull/98590",
      "locator": {
        "locator_type": "json_pointer",
        "value": "/0/body"
      },
      "source_artifact_ref": "src_e3e5bb632a9008fc"
    },
    {
      "content_hash": "sha256:8049ca847b866e60318a51286470f7faec1eaba7a81e4f3514a795b2733c990e",
      "evidence_id": "ev_fcf096993fb8ca9c",
      "excerpt": "The issue is about accessing illegal memory when doing indexing `x[idx]` with invalid indices `idx`. As the real value of `idx` is unknown until running cpp output code, the validation checking need to be done in cpp code. For triton, it adopts `device_asserts` (https://github.com/pytorch/pytorch/pull/98590). For cpp, I suppose maybe to generate a specific kernel for such checking, but I am not clear about the details now. Do you have any idea about the solution? cc @jgong5 @EikanWang",
      "locator": {
        "locator_type": "json_pointer",
        "value": "/2/body"
      },
      "source_artifact_ref": "src_e3e5bb632a9008fc"
    }
  ],
  "identity": {
    "canonical_url": "https://github.com/pytorch/pytorch/issues/100343",
    "issue_number": 100343,
    "report_id": "br_pytorch_pytorch_100343",
    "repository": "pytorch/pytorch"
  },
  "provenance": {
    "builder_id": "build_bug_report_json",
    "builder_version": "5.1.1",
    "content_hash": "sha256:15906a6458b8daff47703953bde4560340de69b108a99da77f4a9ef9ff2146d5",
    "generated_at": "2026-10-03T01:05:25Z",
    "generation_run_id": "run_0db5480407c24ad2",
    "input_artifact_refs": [
      {
        "content_hash": "sha256:1366a172dbda5fa63f54671de6a68b8e9c4131b409d1d7b7a3967ac6c6d453ce",
        "local_path": "dataset/manifests/report_v5_calibration_inventory.json"
      },
      {
        "content_hash": "sha256:93b3d122125fd61e2e5d072558f49001312551c26347ba011e493b09aff48841",
        "local_path": "dataset/raw/report_v3_calibration/20260928/issue_100343/capture.json"
      }
    ],
    "mapping_ref": {
      "content_hash": "sha256:628a315eee3abe0ccdbeb23394e7879413bb308e84802320285b4bc00f492ced",
      "local_path": "experiment/EXP006_historical_bug_pattern_dataset/schemas/source_to_report_mapping.md"
    }
  },
  "reported_behavior": {
    "environment_facts": [
      {
        "evidence_refs": [
          "ev_f7ea9c3c446d285f"
        ],
        "fact_id": "env_efa8d796154fef9d",
        "name": "reported_environment",